A1: ECUADOR. SISTEMA ANDINO DE FRANJAS DE PRECIOS
A2: DETERMINACION DEL ARANCEL PARA LA SEGUNDA QUINCENA DE DICIEMBRE/2000
A3: USD/TM
A4: PAISES QUE NO PERTENECEN A ALADI 4/
A5: SUBPARTIDA | B5: PRODUCTO 2/ - 4/ | C5: PRECIO | D5: PRECIO | E5: PRECIO | F5: % ARANCEL | G5: TASA | H5: % ARANCEL | I5: % DERECHO | J5: TOTAL | K5: ARANCEL | L5: TECHO
A6: NANDINA | C6: PISO | D6: TECHO | E6: REFERENCIAL | F6: AD-VALOREM | G6: DE | H6: AD-VALOREM | I6: VARIABLE | J6: GRAVAMEN | K6: EXTERNO | L6: CONSOLIDADO
A7: 381 | C7: CIF | D7: CIF | E7: CIF | F7: SOBRE CIF | G7: SALVAGUARDIA | H7: SOBRE CIF | I7: ADICIONAL | J7: ARANCELARIO | K7: COMUN | L7: OMC
C8: * | D8: * | E8: ** | F8: REFERENCIAL | G8: *** | H8: REFERENCIAL | I8: SOBRE CIF
H9: ARAN+SALV.*** | I9: REFERENCIAL
A10: 1006.30.00 | B10: ARROZ 10% PARTIDO 1/ | C10: 346 | D10: 396 | E10: 221 | F10: =H10-G10 -> 00.2 | G10: 00.1 | H10: 00.3 | I10: 00.45 | J10: =H10+I10 -> 0.75 | K10: 00.2 | L10: 0.75
A11: 1701.99.00 | B11: AZUCAR BLANCA 1/ | C11: 362 | D11: 450 | E11: 270 | F11: =H11-G11 -> 00.15 | G11: 00.08 | H11: 00.23 | I11: 00.27 | J11: =H11+I11 -> 0.5 | K11: 00.2 | L11: 0.5
A12: 1701.11.90 | B12: AZUCAR CRUDA | C12: 267 | D12: 332 | E12: 242 | F12: =H12-G12 -> 00.15 | G12: 00.08 | H12: 00.23 | I12: =IF(IF(E12<C12,(C12-E12)*(1+K12)/E12,IF(AND(E12>=C12,E12<=D12),0,(D12-E12)*(1+K12)/E12))<-H12,-H12,IF(E12<C12,(C12-E12)*(1+K12)/E12,IF(AND(E12>=C12,E12<=D12),0,(D12-E12)*(1+K12)/E12))) -> 0.12396694214876033 | J12: =H12+I12 -> 0.35396694214876034 | K12: 00.2 | L12: 0.5
A13: 1003.00.90 | B13: CEBADA #2 | C13: 141 | D13: 172 | E13: 135 | F13: =H13-G13 -> 00.15 | G13: 00.08 | H13: 00.23 | I13: =IF(IF(E13<C13,(C13-E13)*(1+K13)/E13,IF(AND(E13>=C13,E13<=D13),0,(D13-E13)*(1+K13)/E13))<-H13,-H13,IF(E13<C13,(C13-E13)*(1+K13)/E13,IF(AND(E13>=C13,E13<=D13),0,(D13-E13)*(1+K13)/E13))) -> 5.1111111111111107E-2 | J13: =H13+I13 -> 0.28111111111111109 | K13: 00.15 | L13: 00.4
A14: 1005.90.11 | B14: MAIZ AMARILLO 3/ | C14: 159 | D14: 195 | E14: 110 | F14: 00.15 | G14: 0 | H14: 00.15 | I14: 00.31 | J14: =H14+I14 -> 00.46 | K14: 00.15 | L14: 0.5
A15: 1005.90.12 | B15: MAIZ BLANCO 1/ | C15: 152 | D15: 186 | E15: 119 | F15: =H15-G15 -> 00.15 | G15: 00.08 | H15: 00.23 | I15: 00.27 | J15: =H15+I15 -> 0.5 | K15: 00.15 | L15: 0.5
A16: 1201.00.90 | B16: SOYA EN GRANO 1/ | C16: 263 | D16: 312 | E16: 211 | F16: =H16-G16 -> 00.15 | G16: 00.08 | H16: 00.23 | I16: 00.17 | J16: =H16+I16 -> 00.4 | K16: 00.15 | L16: 00.4
A17: 1507.10.00 | B17: ACEITE DE SOYA 1/ | C17: 568 | D17: 666 | E17: 325 | F17: =H17-G17 -> 00.2 | G17: 00.1 | H17: 00.3 | I17: 00.05 | J17: =H17+I17 -> 00.35 | K17: 00.2 | L17: 00.35
A18: 1511.10.00 | B18: ACEITE DE PALMA 1/ | C18: 599 | D18: 705 | E18: 292 | F18: =H18-G18 -> 00.2 | G18: 00.1 | H18: 00.3 | I18: 00.05 | J18: =H18+I18 -> 00.35 | K18: 00.2 | L18: 00.35
A19: 0207.14.00 | B19: TROZOS DE POLLO 1/ | C19: 1367 | D19: 1498 | E19: 720 | F19: =H19-G19 -> 00.2 | G19: 00.1 | H19: 00.3 | I19: 00.6 | J19: =H19+I19 -> 00.9 | K19: 00.2 | L19: 00.9
A20: 0203.29.00 | B20: CARNE DE CERDO 1/ | C20: 1453 | D20: 1842 | E20: 1145 | F20: =H20-G20 -> 00.2 | G20: 00.1 | H20: 00.3 | I20: 00.2 | J20: =H20+I20 -> 0.5 | K20: 00.2 | L20: 0.5
A21: 0402.21.19 | B21: LECHE EN POLVO | C21: 2197 | D21: 2487 | E21: 1983 | F21: =H21-G21 -> 00.2 | G21: 00.1 | H21: 00.3 | I21: =IF(IF(E21<C21,(C21-E21)*(1+K21)/E21,IF(AND(E21>=C21,E21<=D21),0,(D21-E21)*(1+K21)/E21))<-H21,-H21,IF(E21<C21,(C21-E21)*(1+K21)/E21,IF(AND(E21>=C21,E21<=D21),0,(D21-E21)*(1+K21)/E21))) -> 0.12950075642965206 | J21: =H21+I21 -> 0.42950075642965202 | K21: 00.2 | L21: 00.8
A22: * Precios piso y techo vigentes para el período abril 1ero. de 2000 al 31 de marzo del 2001, de acuerdo a la Resolución de la Secretaría General de la Comunidad Andina 328 del 14 de diciembre de 1999. ** Precio Quincenal Referencial que esta vigente en la SEGUNDA QUINCENA DE DICIEMBRE/2000. Decisiones 371, 392, 396 y 402, 403, 410, 411, 413, 422, 430, 432, 433, 468, 469, 470, Resoluciones 169, 267, 338 *** Cláusula de Salvaguardia establecida en el Decreto Ejecutivo No.609 del 19 de febrero de 1999/ Decreto Ejecutivo No.655 del 9 de agosto de 2000./ Decreto Ejecutivo No.555 publicado el 11 de julio de 2000. 1/ Decisión 430 de la JUNAC. Limitación de la magnitud de los derechos variables para el cumplimiento de niveles arancelarios consolidados asumidos ante la OMC: Dado que los compromisos del Ecuador ante la OMC, determinan que el techo consolidado sea 75% para Arroz, 50% para Azúcar Blanco, Maíz Blanco y Carne de Cerdo, 40% para Soya, 35% para Aceite de Soya y Aceite de Palma y 90% para Trozos de Pollo, se establece que el Derecho Variable Adicional para la quincena sea de 45% y no 68% para Arroz, 27% y no 41% para azúcar blanco, 27% y no 32% para Maíz Blanco, 20% y no 32% para Carne de Cerdo, 17% y no 28% para Soya, 5% y no 90% para Aceite de Soya, 5% y no 126% para Aceite de Palma y 60% y no 108% para Trozos de Pollo. 2/ Decreto Ejecutivo No.555, publicado en el Registro Oficial No.117 del 11 de julio del año 2000. Excluye al trigo y sus derivados del Sistema Andino de Franja de Precios. 3/ Decreto Ejecutivo No.985 del 21 de noviembre de 2000. Limita la aplicación de los Derechos Variables para Maíz Amarillo, hasta un arancel total máximo del 46% y elimina tasa de salvaguardia 4/ Decreto Ejecutivo No.1040 del 7 de diciembre de 2000. Elimina la Salvaguardia para países de la ALADI y otros rubros.

A1: Comercio Exterior